{
  "schemaVersion": "1.0",
  "manifestVersion": "1.0.0",
  "id": "field-inspection-power-platform",
  "displayName": "Field inspection and approval",
  "platform": "power-platform",
  "nativeArtifactPath": "automations/power-platform/field-inspection/solution/Connectors/ste_syntheticoperations/apiDefinition.swagger.json",
  "sourceChecksum": "5641b340b16a563f4f2cac27437d3c5f6f9d66616403faca6f675c937174865b",
  "owner": {
    "email": "automation.owner@example.test",
    "supportGroup": "Field Operations"
  },
  "businessCapability": "Synthetic field inspection approval",
  "riskTier": "MEDIUM",
  "dataClassification": "CONFIDENTIAL",
  "trigger": {
    "type": "EVENT",
    "expectedSlaSeconds": 1800,
    "alertAfterSeconds": 3600
  },
  "dependencies": [
    {
      "name": "synthetic-operations-api",
      "type": "API",
      "required": true
    },
    {
      "name": "dataverse",
      "type": "DATABASE",
      "required": false
    }
  ],
  "targets": [
    {
      "environment": "demo",
      "releaseStrategy": "MANUAL"
    },
    {
      "environment": "production",
      "releaseStrategy": "PROMOTED"
    }
  ],
  "runbookPath": "docs/runbooks/field-inspection.md",
  "recoveryPath": "docs/runbooks/field-inspection-recovery.md",
  "credentialReferences": [
    {
      "name": "SYNTHETIC_OPERATIONS_API_KEY",
      "purpose": "Call synthetic field inspection resources"
    },
    {
      "name": "POWER_PLATFORM_CONNECTION_REFERENCE",
      "purpose": "Optional hosted environment connection reference"
    }
  ]
}
