{
  "schemaVersion": "1.0",
  "manifestVersion": "1.0.0",
  "id": "partner-onboarding-zapier",
  "displayName": "Partner onboarding integration",
  "platform": "zapier",
  "nativeArtifactPath": "automations/zapier/partner-onboarding/integration-definition.json",
  "sourceChecksum": "37d22a5e07577ebe0acf8c96ee5858f0d463e09c7319e8719aae0e209996061e",
  "owner": {
    "email": "automation.owner@example.test",
    "supportGroup": "Partner Operations"
  },
  "businessCapability": "Synthetic partner onboarding",
  "riskTier": "MEDIUM",
  "dataClassification": "CONFIDENTIAL",
  "trigger": {
    "type": "POLLING",
    "expectedSlaSeconds": 900,
    "alertAfterSeconds": 1200
  },
  "dependencies": [
    {
      "name": "synthetic-operations-api",
      "type": "API",
      "required": true
    }
  ],
  "targets": [
    {
      "environment": "demo",
      "releaseStrategy": "MANUAL"
    },
    {
      "environment": "production",
      "releaseStrategy": "PROMOTED"
    }
  ],
  "runbookPath": "docs/runbooks/partner-onboarding.md",
  "recoveryPath": "docs/runbooks/partner-onboarding-recovery.md",
  "credentialReferences": [
    {
      "name": "SYNTHETIC_PARTNER_API",
      "purpose": "Call synthetic partner application resources"
    },
    {
      "name": "ZAPIER_DEPLOYMENT",
      "purpose": "Optional hosted deployment reference"
    }
  ]
}
