{
  "schemaVersion": "1.0",
  "manifestVersion": "1.0.0",
  "id": "return-refund-make",
  "displayName": "Commerce return and refund orchestration",
  "platform": "make",
  "nativeArtifactPath": "automations/make/return-refund/blueprint.json",
  "sourceChecksum": "86951c5b0e2becb8e10f566eea46f65aaf56e6db4f89d7de3d3950b30af47245",
  "owner": {
    "email": "automation.owner@example.test",
    "supportGroup": "Commerce Operations"
  },
  "businessCapability": "Synthetic return and refund handling",
  "riskTier": "HIGH",
  "dataClassification": "CONFIDENTIAL",
  "trigger": {
    "type": "WEBHOOK",
    "expectedSlaSeconds": 600,
    "alertAfterSeconds": 900
  },
  "dependencies": [
    {
      "name": "synthetic-operations-api",
      "type": "API",
      "required": true
    }
  ],
  "targets": [
    {
      "environment": "demo",
      "releaseStrategy": "MANUAL"
    },
    {
      "environment": "production",
      "releaseStrategy": "PROMOTED"
    }
  ],
  "runbookPath": "docs/runbooks/return-refund.md",
  "recoveryPath": "docs/runbooks/return-refund-recovery.md",
  "credentialReferences": [
    {
      "name": "SYNTHETIC_OPERATIONS_API",
      "purpose": "Locate synthetic order, return, and refund resources"
    },
    {
      "name": "SYNTHETIC_OPERATIONS_API_KEY",
      "purpose": "Authenticate synthetic operations API requests"
    },
    {
      "name": "MAKE_CONNECTION",
      "purpose": "Optional hosted scenario connection reference"
    }
  ]
}
